{
  "model_id": "aquila-42-yacht",
  "brand_id": "aquila",
  "family": "Aquila Yacht",
  "model_name": "Aquila 42 Yacht",
  "category": "power_catamaran",
  "lifecycle_status": "CURRENT",
  "model_year": "2023",
  "manufacturer_url": "https://www.aquilaboats.com/models/yachts/42",
  "oceanic_url": null,
  "confidence_level": "MEDIUM",
  "specifications": {
    "eslora_m": 12.64,
    "manga_m": 6.4,
    "calado_m": 1.1,
    "desplazamiento_kg": "UNKNOWN",
    "motorizacion": "2 x Volvo Penta 300 HP (según fuente de tercero, sea trial reportado)",
    "potencia_max": "UNKNOWN",
    "velocidad_max_nudos": 21.6,
    "velocidad_crucero_nudos": 16.6,
    "capacidad_combustible_l": "UNKNOWN",
    "capacidad_agua_l": "UNKNOWN",
    "pasajeros": "UNKNOWN",
    "camarotes": "2 (más camarote de servicio con litera individual), con layouts opcionales de 3 o 4 camarotes",
    "banos": "2 (layout base) o 3 (según layout opcional)"
  },
  "discrepancies": [],
  "sources": [
    {
      "url": "https://www.aquilaboats.com/models/yachts/42",
      "level": 1,
      "level_label": "PRIMARY",
      "retrieved_at": "2026-09-10",
      "retrieval_method": "web_search_snippet",
      "verification_state": "UNCONFIRMED",
      "notes": "Página de modelo del fabricante vía snippet de búsqueda. Acceso directo bloqueado (EGRESS_BLOCKED)."
    },
    {
      "url": "https://www.instagram.com/oceanic_chile/reel/C5zFQ7NJVxT/",
      "level": 2,
      "level_label": "AUTHORIZED",
      "retrieved_at": "2026-09-10",
      "retrieval_method": "web_search_snippet",
      "verification_state": "UNCONFIRMED",
      "notes": "Publicación del canal oficial de Instagram de Oceanic Chile (@oceanic_chile) titulada 'El Aquila 42 Yacht Power Catamaran está equipado con...' -- evidencia directa (nivel 2, canal propio de Oceanic) de que Oceanic promociona este modelo, aunque no se confirmó una página de producto dedicada en el dominio oceanic.cl."
    },
    {
      "url": "https://boattest.com/boats/aquila/42-2023",
      "level": 3,
      "level_label": "SECONDARY",
      "retrieved_at": "2026-09-10",
      "retrieval_method": "web_search_snippet",
      "verification_state": "UNCONFIRMED",
      "notes": "Fuente de especificaciones: LOA 41'6\" (12.64 m), manga 21' (6.4 m), calado 3'7\" (1.1 m), velocidad top 21.6 nudos y crucero 16.6 nudos con motores 300 HP Volvo Penta en la prueba. Consistente con yachtstyle.co."
    }
  ],
  "verified_at": "2026-09-10",
  "last_updated": "2026-09-10",
  "status_pipeline": "MAPPED",
  "notes": "Introducido en 2023 como el modelo 'más nuevo y pequeño' de la categoría Yacht del fabricante en ese momento. No confundir con el Aquila 42 Coupe (línea Coupe, distinta, ver aquila-42-coupe.json): comparten el número '42' pero son modelos separados con layouts y propósito diferentes (flybridge crucero vs. weekender techo bajo)."
}
