{
  "model_id": "lagoon-sixty-5",
  "brand_id": "lagoon",
  "family": "Lagoon Sixty 5",
  "model_name": "Lagoon Sixty 5",
  "variants": [
    {
      "variant_name": "4 cabanas",
      "confidence_level": "LOW",
      "notes": "No confirmado por fetch directo."
    },
    {
      "variant_name": "5 cabanas (Salon)",
      "confidence_level": "LOW",
      "notes": "No confirmado por fetch directo."
    },
    {
      "variant_name": "6 cabanas (Salon)",
      "confidence_level": "LOW",
      "notes": "No confirmado por fetch directo."
    }
  ],
  "category": "power_catamaran",
  "lifecycle_status": "CURRENT",
  "model_year": null,
  "manufacturer_url": "https://www.catamarans-lagoon.com/boats/sixty-5",
  "oceanic_url": null,
  "confidence_level": "LOW",
  "specifications": {
    "eslora_m": 20.55,
    "manga_m": 10.0,
    "calado_m": 1.6,
    "desplazamiento_kg": "UNKNOWN",
    "capacidad_combustible_l": 1300,
    "capacidad_agua_l": 1100,
    "camarotes": "4, 5 o 6",
    "banos": "UNKNOWN",
    "pasajeros_max": "UNKNOWN",
    "motorizacion_estandar": "2 x 150 HP o 2 x 195 HP"
  },
  "discrepancies": [],
  "sources": [
    {
      "url": "https://www.catamarans-lagoon.com/boats/sixty-5",
      "level": 1,
      "level_label": "PRIMARY",
      "retrieved_at": "2026-09-10",
      "retrieval_method": "web_search_snippet",
      "verification_state": "UNCONFIRMED",
      "notes": "Página de modelo del fabricante vía snippet de búsqueda. Especificaciones consistentes con multihulls-world.com y tmgyachts.com."
    }
  ],
  "verified_at": "2026-09-10",
  "last_updated": "2026-09-10",
  "status_pipeline": "MAPPED",
  "notes": "Parte de la línea de catamaranes A MOTOR de Lagoon ('Power catamarans', catamarans-lagoon.com/ranges/power-catamarans). No se encontró evidencia de que este modelo específico tenga página propia en oceanic.cl ni de que Oceanic lo represente -- a diferencia del Lagoon Seventy 8, que SÍ está confirmado en oceanic.cl (ver lagoon-seventy-8.json). Se documenta como catálogo global del fabricante únicamente. oceanic_url null. No se afirma que Oceanic no lo represente, solo que no se pudo confirmar en esta pasada (CLAUDE.md secciones 6 y 22)."
}
